<?xml version="1.0" encoding="UTF-8"?>
<empresa xmlns:xsi="http://www.w3.org/2001/XMLSchema-instance" xsi:noNamespaceSchemaLocation="file:/C:/1-DAM/Lenguajes%20de%20Marcas/Repaso_Examen_XML_XPath/Empresa2.xsd">
  <trabajador id="T1">
    <nombre>Ana López</nombre>
    <edad>28</edad>
    <salario moneda="EUR">1800.50</salario>
    <departamento>IT</departamento>
  </trabajador>
  <trabajador id="T2">
    <nombre>Juan Pérez</nombre>
    <edad>35</edad>
    <salario moneda="USD">2100.00</salario>
    <departamento>RRHH</departamento>
  </trabajador>
</empresa>